packet_id,doc_id,source_url,page_number,block_number,excerpt_id,citation_token,word_count,token_count,x0,y0,x1,y1,text
packet_2,DOC001,https://cdn.ca9.uscourts.gov/datastore/opinions/2023/02/03/20-35838.pdf,61,3,P061.B03,DOC001[P061.B03],16,40,54.0,35.0,348.0,362.84,"(cleaned up) (quoting Britton v. Co-op Banking Grp. , 916 F.2d 1405, 1413 (9th Cir. 1990))."
packet_2,DOC001,https://cdn.ca9.uscourts.gov/datastore/opinions/2023/02/03/20-35838.pdf,61,4,P061.B04,DOC001[P061.B04],101,167,54.0,366.48,348.0,534.44,"Those requirements, until today, have ensured that we remember a key fact: “Waiver is different from forfeiture.” United States v. Olano , 507 U.S. 725, 733 (1993). On the one hand, waiver is the “intentional relinquishment or abandonment of a known right,” id. (cleaned up), such that it must be “affirmative and intentional,” Berkshire v. Dahl , 928 F.3d 520, 530 (6th Cir. 2019). On the other hand, forfeiture can be inadvertent and often occurs due to a “mistake or oversight,” United States v. Williams , 930 F.3d 44, 64 (2d Cir. 2019) (internal citation omitted), such as a party’s"
packet_2,DOC001,https://cdn.ca9.uscourts.gov/datastore/opinions/2023/02/03/20-35838.pdf,61,5,P061.B05,DOC001[P061.B05],20,30,54.0,366.48,348.0,534.44,"“failure to make the timely assertion of a right,” Berkshire , 928 F.3d at 530. To be sure, parties “can"
packet_2,DOC001,https://cdn.ca9.uscourts.gov/datastore/opinions/2023/02/03/20-35838.pdf,62,1,P062.B01,DOC001[P062.B01],98,158,54.0,35.0,345.0,278.24,"62 T IFFANY H ILL V . X EROX B USINESS S ERVICES , LLC impliedly waive a right.” Newirth , 931 F.3d at 942; see also Van Ness Townhouses v. Mar Indus. Corp. , 862 F.2d 754, 759 (9th Cir. 1988). But a right can be impliedly waived only if “the parties’ actions amount to a knowing relinquishment of that right.” Newirth , 931 F.3d at 942; see also Van Ness Townhouses , 862 F.2d at 759. B. Analysis Applying this legal standard to the facts in this case, the outcome is clear. XBS could have waived its right"
packet_2,DOC001,https://cdn.ca9.uscourts.gov/datastore/opinions/2023/02/03/20-35838.pdf,62,2,P062.B02,DOC001[P062.B02],47,57,54.0,35.0,345.0,278.24,"to compel arbitration only if it took some concrete act suggesting it intended to waive that right. More than a decade into litigation, it still hasn’t taken any such act. Ergo, it did not waive its right. No simpler syllogism ever echoed in Aristotle’s Lyceum."
packet_2,DOC001,https://cdn.ca9.uscourts.gov/datastore/opinions/2023/02/03/20-35838.pdf,62,3,P062.B03,DOC001[P062.B03],101,124,54.0,281.88,345.0,469.9,"The majority does not really dispute the minor premise of that syllogism, i.e., the nonexistence of any concrete act that demonstrates waiver. Nor could it. But the majority erases the major premise and scribbles a novel forfeiture rule in its place. Under that new rule, a defendant forfeits its right to compel arbitration not only if it engages in a concrete inconsistent act, but also if a court conjectures from the “totality of the circumstances” that the defendant secretly intended to forfeit that right. Such a radical and unbounded expansion of waiver finds no support in precedent, and in any"
packet_2,DOC001,https://cdn.ca9.uscourts.gov/datastore/opinions/2023/02/03/20-35838.pdf,62,4,P062.B04,DOC001[P062.B04],20,25,54.0,281.88,345.0,469.9,event fails here even on its own terms. 1. The Majority Offers No Evidence of Any Concrete Act of Waiver.
packet_2,DOC001,https://cdn.ca9.uscourts.gov/datastore/opinions/2023/02/03/20-35838.pdf,62,5,P062.B05,DOC001[P062.B05],38,45,54.0,473.28,345.0,530.84,"There are special considerations for the waiver analysis 
in class actions, and those considerations are at the heart of 
my disagreement with the majority.  In a simpler world in 
which Ms. Hill herself was subject to an arbitration"
packet_2,DOC001,https://cdn.ca9.uscourts.gov/datastore/opinions/2023/02/03/20-35838.pdf,63,1,P063.B01,DOC001[P063.B01],98,128,54.0,35.0,348.0,307.64,"T IFFANY H ILL V . X EROX B USINESS S ERVICES , LLC 63 agreement like the putative class members she sought to represent, XBS could have (and presumably would have) immediately moved to compel arbitration with her. If it instead opted to litigate against her, we could reasonably conclude that XBS had intentionally waived its right to arbitrate her claims. But because Ms. Hill was not in fact subject to any arbitration agreement with XBS, XBS could not compel her to arbitrate her claims or class certification issues. Nor could XBS move to compel arbitration against putative class"
packet_2,DOC001,https://cdn.ca9.uscourts.gov/datastore/opinions/2023/02/03/20-35838.pdf,63,2,P063.B02,DOC001[P063.B02],69,84,54.0,35.0,348.0,307.64,"members who had signed arbitration agreements until after the class was finally certified and its members identified. Meanwhile, XBS needed to determine whether Ms. Hill’s individual claims could survive a motion to dismiss or a motion for summary judgment. And XBS disagreed that her class claims satisfied all Rule 23 criteria. Possessing no contractual right to arbitrate any of those issues, XBS had to litigate them in court."
packet_2,DOC001,https://cdn.ca9.uscourts.gov/datastore/opinions/2023/02/03/20-35838.pdf,63,3,P063.B03,DOC001[P063.B03],99,132,54.0,311.28,345.0,540.44,"It is black-letter law that, until the class was finally certified and notice given, none of the absent putative class members were actually parties to the litigation between Ms. Hill and XBS. See Smith v. Bayer Corp. , 564 U.S. 299, 313 (2011) (rejecting “the novel and surely erroneous argument that a nonnamed class member is a party to the class-action litigation before the class is certified ” (internal quotation marks and citation omitted)). Presumably because of this, XBS limited its precertification litigation to issues related to Ms. Hill and her attempt to certify a class. Time and again and"
packet_2,DOC001,https://cdn.ca9.uscourts.gov/datastore/opinions/2023/02/03/20-35838.pdf,63,4,P063.B04,DOC001[P063.B04],48,61,54.0,311.28,345.0,540.44,"without exception, XBS restricted its answers, discovery, motion for summary judgment—everything—to issues related to Ms. Hill’s personal claims and her proposed class’s alleged inadequacies under Rule 23. This tailoring of XBS’s litigation activity was no doubt informed by a bright-line distinction well-understood until"
packet_2,DOC001,https://cdn.ca9.uscourts.gov/datastore/opinions/2023/02/03/20-35838.pdf,64,1,P064.B01,DOC001[P064.B01],98,122,54.0,35.0,348.0,376.64,"64 T IFFANY H ILL V . X EROX B USINESS S ERVICES , LLC smudged today. Waiver analysis in a case like this involving a named plaintiff who did not sign an arbitration agreement requires a court to distinguish between a defendant who (1) actively litigates against someone with whom the defendant has no right to arbitrate or against class certification generally, from one who (2) attempts to actively litigate against someone with whom the defendant does have a right to arbitrate. Only the latter defendant can be said to have acted consistent with an intent to waive its"
packet_2,DOC001,https://cdn.ca9.uscourts.gov/datastore/opinions/2023/02/03/20-35838.pdf,64,2,P064.B02,DOC001[P064.B02],101,122,54.0,35.0,348.0,376.64,"right to arbitrate. In contrast, a defendant sued by a named plaintiff seeking to certify a class and who defends the lawsuit in court before the class is certified, cannot be said to be making an “intentional decision” to “take advantage of being in court” when that defendant is powerless to force the named plaintiff to arbitrate either her own claims or class certification. Newirth , 931 F.3d at 941 . That’s because the defendant has no choice but to defend against the named plaintiff’s claims in court. Likewise, when the same defendant fights against class certification in court it"
packet_2,DOC001,https://cdn.ca9.uscourts.gov/datastore/opinions/2023/02/03/20-35838.pdf,64,3,P064.B03,DOC001[P064.B03],34,38,54.0,35.0,348.0,376.64,cannot be said to be taking advantage of litigating in the judicial forum because it has no option to do otherwise; it cannot force the named plaintiff to arbitrate the question of class certification.
packet_2,DOC001,https://cdn.ca9.uscourts.gov/datastore/opinions/2023/02/03/20-35838.pdf,64,4,P064.B04,DOC001[P064.B04],95,136,54.0,380.28,348.0,534.44,"It is against that background understanding that we 
should evaluate whether XBS did anything to evince an 
intention to litigate specifically against the 2002 signatories.  
The majority says it did, pointing to three “acts” in this case 
that together purportedly expose XBS’s covert intent to 
waive its right to compel arbitration against those specific 
class members.  First, XBS supposedly moved for partial 
summary judgment on the issue of “whether unnamed class 
members subject to XBS’s ABC Pay scheme were 
‘piecemeal’ workers” under Washington’s Minimum Wage 
Act.  Second, XBS requested “extensive discovery on"
packet_2,DOC001,https://cdn.ca9.uscourts.gov/datastore/opinions/2023/02/03/20-35838.pdf,65,1,P065.B01,DOC001[P065.B01],102,142,54.0,35.0,348.0,264.44,"T IFFANY H ILL V . X EROX B USINESS S ERVICES , LLC 65 unnamed parties to the case,” which “necessarily included signatories to the 2002 DRP.” Third, XBS many times “asserted as a ground for obligatory arbitration the 2012 DRP without also asserting the same for the 2002 DRP.” I will discuss each in turn. a. XBS’s motion for summary judgment The majority’s first purported “act” cannot prove XBS’s intent to waive for the simple reason that it never happened. The majority portrays XBS’s summary judgment motion as directed at “unnamed class members.” But the motion nowhere mentions"
packet_2,DOC001,https://cdn.ca9.uscourts.gov/datastore/opinions/2023/02/03/20-35838.pdf,65,2,P065.B02,DOC001[P065.B02],23,30,54.0,35.0,348.0,264.44,"“unnamed class members,” and even a quick reading makes clear that, as one might expect, the motion addressed Ms. Hill and her claims."
packet_2,DOC001,https://cdn.ca9.uscourts.gov/datastore/opinions/2023/02/03/20-35838.pdf,65,3,P065.B03,DOC001[P065.B03],104,117,54.0,268.08,345.0,518.84,"While the majority can’t show that XBS’s motion for summary judgment actually addressed absent class members, what it instead relies on is that a grant of summary judgment against Ms. Hill could have indirectly affected the claims of the putative class members she purported to represent. Sure. That will usually be the case when litigating against a named plaintiff of a putative class action. But indirect downstream effects are not the same as active litigation against the class members or their claims. XBS’s motion was entirely consistent with the fact that it was actively defending itself against Ms. Hill’s claims."
packet_2,DOC001,https://cdn.ca9.uscourts.gov/datastore/opinions/2023/02/03/20-35838.pdf,65,4,P065.B04,DOC001[P065.B04],77,88,54.0,268.08,345.0,518.84,"By moving for summary judgment and making the arguments it made, XBS did nothing different than what it would have done if Ms. Hill had brought an individual action for her own claims instead of a putative class action. XBS had little choice but to seek summary judgment against Ms. Hill at that stage of the case, and the fact that it did so shows only that it was actively litigating against her, not against the then-"
packet_2,DOC001,https://cdn.ca9.uscourts.gov/datastore/opinions/2023/02/03/20-35838.pdf,66,1,P066.B01,DOC001[P066.B01],97,126,54.0,35.0,344.51,225.33,"66 T IFFANY H ILL V . X EROX B USINESS S ERVICES , LLC uncertified class. 1 1 A careful reader might be confused by how the majority and I differently use the concept of whom the litigation was “directed at.” I use the concept to refer to whomever XBS’s litigation conduct was aimed at as a legal matter . Thus, for example, when XBS made arguments in support of its motion for summary judgment against Ms. Hill , I consider those arguments as directed at Ms. Hill, not at absent class members. It would have been strange indeed"
packet_2,DOC001,https://cdn.ca9.uscourts.gov/datastore/opinions/2023/02/03/20-35838.pdf,66,2,P066.B02,DOC001[P066.B02],26,29,54.0,35.0,344.51,225.33,"had XBS made arguments directed against absent class members in support of its summary judgment motion, since those class members were not parties to the case."
packet_2,DOC001,https://cdn.ca9.uscourts.gov/datastore/opinions/2023/02/03/20-35838.pdf,66,3,P066.B03,DOC001[P066.B03],103,126,53.99,229.44,344.53,369.37,"Only once does the majority claim XBS did anything like that— directed its arguments against class members to the exclusion of Ms. Hill—and the majority is simply wrong. It selectively quotes one of XBS’s summary judgment briefs before the district court, claiming XBS therein contested a claim “raised by ‘class counsel’” but “‘not advanced by Hill.’” But contrary to the majority’s suggestion, XBS never attempted to direct any argument against the absent class members and not Ms. Hill. Instead, in the passage referenced by the majority XBS merely highlighted that Ms. Hill in her deposition had disavowed any independent knowledge"
packet_2,DOC001,https://cdn.ca9.uscourts.gov/datastore/opinions/2023/02/03/20-35838.pdf,66,4,P066.B04,DOC001[P066.B04],31,37,53.99,229.44,344.53,369.37,of a claim that her counsel had raised in her answers to interrogatories. XBS never said it was contesting a claim related only to the class and not to Ms. Hill.
packet_2,DOC001,https://cdn.ca9.uscourts.gov/datastore/opinions/2023/02/03/20-35838.pdf,66,5,P066.B05,DOC001[P066.B05],102,122,53.99,373.48,347.02,541.31,"Instead, the key difference between the majority opinion and this dissent is that the former generally appears to embrace what might be called the “ricochet” view of targeting, ignoring whomever XBS’s legal arguments were technically directed at, and looking instead to whomever the majority thinks XBS may have sub rosa hoped could be indirectly affected by its legal arguments if they were successful against Ms. Hill. Under the majority’s view, a defendant such as XBS apparently targets class members against whom it cannot yet litigate when it trains its sights on a named plaintiff such as Ms. Hill, directing its"
packet_2,DOC001,https://cdn.ca9.uscourts.gov/datastore/opinions/2023/02/03/20-35838.pdf,66,6,P066.B06,DOC001[P066.B06],48,56,53.99,373.48,347.02,541.31,"arguments against her as a legal matter, but with the surreptitious hope of also indirectly affecting the absent class members’ claims. That is, a defendant can target a hypothetical future class member—at least for waiver purposes—even when as a legal matter its litigation activity is directed"
packet_2,DOC001,https://cdn.ca9.uscourts.gov/datastore/opinions/2023/02/03/20-35838.pdf,67,1,P067.B01,DOC001[P067.B01],98,143,54.0,35.0,345.0,362.84,"T IFFANY H ILL V . X EROX B USINESS S ERVICES , LLC 67 Notably, XBS’s summary judgment motion is the only example of active litigation the majority references. So even if moving for summary judgment against Ms. Hill somehow also counted as “active litigation” against the uncertified class (which it should not), this single “act” would not come close to the “prolonged” litigation that we have required in other cases to find waiver. Newirth , 931 F.3d at 941. For example, in Van Ness Townhouses , which the majority views as “instructive,” the defendants made a “conscious decision”"
packet_2,DOC001,https://cdn.ca9.uscourts.gov/datastore/opinions/2023/02/03/20-35838.pdf,67,2,P067.B02,DOC001[P067.B02],103,146,54.0,35.0,345.0,362.84,"to waive arbitration by “answer[ing] the complaints and amended complaints, … mov[ing] to dismiss the action,” “approving a pre-trial conference order,” and allowing the district court to set a trial date, all without ever “rais[ing] the issue of arbitration.” 862 F.2d at 756, 759. Importantly, the defendants in Van Ness Townhouses did all this while they “had an existing right to compel arbitration”; indeed, we explained that had the defendants “moved to compel arbitration” at any point, “the district court would have been required to grant that motion.” Id. at 759. Here, it is undisputed that XBS had no such"
packet_2,DOC001,https://cdn.ca9.uscourts.gov/datastore/opinions/2023/02/03/20-35838.pdf,67,3,P067.B03,DOC001[P067.B03],7,11,54.0,35.0,345.0,362.84,right in litigating against Ms. Hill. Ever.
packet_2,DOC001,https://cdn.ca9.uscourts.gov/datastore/opinions/2023/02/03/20-35838.pdf,67,4,P067.B04,DOC001[P067.B04],113,160,54.0,366.48,345.0,540.92,"The distinctions are even starker in other cases.  In 
Martin v. Yasuda , for example, we found waiver only after, 
inter alia, the defendants “devoted considerable time and 
effort to a joint stipulation structuring the litigation, filed a 
motion to dismiss on a key merits issue, entered into a 
protective order, answered discovery, and prepared for and only at a named plaintiff with whom it has no arbitration agreement.  This 
expansive view of who precertification litigation is directed against does 
most of the work for the majority, since in every inchoate class action 
the defendant’s precertification litigation against the named plaintiff will 
inevitably have some possible indirect effect on then-absent putative 
class members."
packet_2,DOC001,https://cdn.ca9.uscourts.gov/datastore/opinions/2023/02/03/20-35838.pdf,68,1,P068.B01,DOC001[P068.B01],98,153,54.0,35.0,348.0,457.64,"68 T IFFANY H ILL V . X EROX B USINESS S ERVICES , LLC conducted a deposition.” 829 F.3d 1118, 1126 (9th Cir. 2016) (cleaned up). Again, all while the right to compel arbitration was just sitting there available but unexercised. And significantly, the defendants in Martin also “told the district judge and opposing counsel that they were likely ‘better off’” litigating the case in court “than handling it in arbitration,” and were even “warned … about the possibility of waiver.” Id. at 1122, 1126. Nothing of the sort remotely happened here. The majority treats XBS as though it"
packet_2,DOC001,https://cdn.ca9.uscourts.gov/datastore/opinions/2023/02/03/20-35838.pdf,68,2,P068.B02,DOC001[P068.B02],104,135,54.0,35.0,348.0,457.64,"actively litigated against the class for years, when in fact the majority can point to only one example of active litigation— that was not even against the class. b. XBS’s “extensive” precertification discovery The majority’s second purported “act” is, like the first, premised on a mistaken understanding of the record. Ms. Hill described XBS’s discovery requests as “extensive.” The majority repeats her characterization verbatim, claiming that XBS “sought to take advantage of litigation in federal court by requesting extensive discovery.” But XBS’s discovery requests consisted of only a handful of interrogatories and requests for production, as well as a grand"
packet_2,DOC001,https://cdn.ca9.uscourts.gov/datastore/opinions/2023/02/03/20-35838.pdf,68,3,P068.B03,DOC001[P068.B03],51,66,54.0,35.0,348.0,457.64,"total of two depositions. That’s it. Notably, XBS’s interrogatories and requests for production were never served on any putative class member. It is a stretch to call this “extensive” discovery, particularly given the breadth of Ms. Hill’s claims and the size of the class she sought to represent."
packet_2,DOC001,https://cdn.ca9.uscourts.gov/datastore/opinions/2023/02/03/20-35838.pdf,68,4,P068.B04,DOC001[P068.B04],50,69,54.0,461.28,345.0,532.64,"But putting that aside, the amount of class discovery 
sought by XBS should be entirely irrelevant to the court’s 
analysis under our test for waiver.  To be consistent with 
precedent, we must focus on  inconsistency .  And an act is 
“inconsistent” with preserving the right to arbitrate only if a"
packet_2,DOC001,https://cdn.ca9.uscourts.gov/datastore/opinions/2023/02/03/20-35838.pdf,69,1,P069.B01,DOC001[P069.B01],71,126,54.0,35.0,345.0,169.64,"T IFFANY  H ILL V . X EROX  B USINESS  S ERVICES , LLC 
69 defendant is litigating something that it could have arbitrated 
instead.   See  Black’s Law Dictionary 915 (Bryan A. Garner 
ed., 11th ed., 2019); Webster’s Third New Int’l Dictionary 
1144 (1986).  Nothing in the discovery XBS sought—or in 
the documents and answers Ms. Hill provided in response—
can 
fairly 
be 
understood 
to 
have 
created 
such 
incompatibility."
packet_2,DOC001,https://cdn.ca9.uscourts.gov/datastore/opinions/2023/02/03/20-35838.pdf,69,2,P069.B02,DOC001[P069.B02],100,149,54.0,173.28,345.0,540.92,"It is the norm in class litigation for a defendant like XBS to conduct such precertification discovery. See, e.g. , Vinole v. Countrywide Home Loans, Inc. , 571 F.3d 935, 942 (9th Cir. 2009) (“Our cases stand for the unremarkable proposition that often the pleadings alone will not resolve the question of class certification and that some discovery will be warranted.”); 1 McLaughlin on Class Actions § 3:7 (19th ed. Nov. 2022) (explaining that “in most cases discovery into issues relevant to class certification is warranted and appropriate” and that “it is ordinarily an abuse of discretion to deny any"
packet_2,DOC001,https://cdn.ca9.uscourts.gov/datastore/opinions/2023/02/03/20-35838.pdf,69,3,P069.B03,DOC001[P069.B03],110,145,54.0,173.28,345.0,540.92,"class certification discovery”). In fact, Rule 23 of the Federal Rules of Civil Procedure was amended two decades ago for the express purpose of accommodating precertification discovery like that which XBS requested. 2 Such precertification discovery is par for the course in class action litigation precisely because such class discovery is expected to “illuminate” class certification issues. Class discovery is not expected to determine or exhaust merits issues unique to the absent class members, even if there can 2 See Report of the Judicial Conference Committee on Rules of Practice and Procedure 10 (Sept. 2002) (available at https://www.uscourts.gov/si tes/default/files/fr_import/ST9-2002.pdf) (explaining"
packet_2,DOC001,https://cdn.ca9.uscourts.gov/datastore/opinions/2023/02/03/20-35838.pdf,69,4,P069.B04,DOC001[P069.B04],30,42,54.0,173.28,345.0,540.92,that Federal Rule of Civil Procedure 23(c)(1)(A) was amended to clarify that “[a] certain amount of [precertification] discovery may be appropriate … to illuminate issues bearing on certification”).
packet_2,DOC001,https://cdn.ca9.uscourts.gov/datastore/opinions/2023/02/03/20-35838.pdf,70,1,P070.B01,DOC001[P070.B01],101,124,54.0,35.0,345.0,540.92,"70 T IFFANY H ILL V . X EROX B USINESS S ERVICES , LLC be some overlap. This case is no exception. In fact, early on, the district court ordered that “[u]ntil the issue of certification is resolved, discovery is limited to class certification issues.” If requesting discovery about class issues at the class certification stage —which happens in essentially every putative class action—is now to be treated as proof of a defendant’s secret intent to waive the right to compel arbitration, we should just be more forthright and explain that defendants must assert their intent to compel arbitration"
packet_2,DOC001,https://cdn.ca9.uscourts.gov/datastore/opinions/2023/02/03/20-35838.pdf,70,2,P070.B02,DOC001[P070.B02],102,121,54.0,35.0,345.0,540.92,"against uncertified class members by some specific deadline during or before class certification proceedings. If we did that, it would be more obvious that the majority’s supposed intentional waiver conclusion is really a disguised accidental forfeiture deadline. But at least it would be a clear rule parties could use to guide their behavior, instead of leaving them to guess how much precertification litigation against the named plaintiff, together with run-of-the-mill class discovery, will result in the “waiver” of merits defenses available only against the class. 3 Unlike the majority, I would conclude that parties should be allowed to engage in"
packet_2,DOC001,https://cdn.ca9.uscourts.gov/datastore/opinions/2023/02/03/20-35838.pdf,70,3,P070.B03,DOC001[P070.B03],102,120,54.0,35.0,345.0,540.92,"normal precertification class discovery without fear of waiving any right to compel arbitration. By repackaging XBS’s class certification-stage discovery requests as proof of intentional waiver of a merits issue, the majority creates both a new rule and unnecessary uncertainty. And as with its treatment of XBS’s necessary 3 Because the majority declines to adopt a bright-line rule today, no class- action defendant within this circuit can know for sure when a district court might find that precertification litigation has proceeded long enough for the judge to deem him or her to have waived a right to compel arbitration. That line"
packet_2,DOC001,https://cdn.ca9.uscourts.gov/datastore/opinions/2023/02/03/20-35838.pdf,70,4,P070.B04,DOC001[P070.B04],12,15,54.0,35.0,345.0,540.92,"will differ judge by judge, court by court, and case by case."
packet_2,DOC001,https://cdn.ca9.uscourts.gov/datastore/opinions/2023/02/03/20-35838.pdf,71,1,P071.B01,DOC001[P071.B01],27,50,54.0,35.0,345.0,100.64,"T IFFANY  H ILL V . X EROX  B USINESS  S ERVICES , LLC 
71 litigation against Ms. Hill, this feels like an unwinnable 
Catch-22 for defendants like XBS."
